{
  "schema_version": 1,
  "snapshot_id": "context-example-001",
  "employee_id": "bot-devlead-0001",
  "created_at": "2026-09-19T12:00:00-04:00",
  "reason": "handoff",
  "stable_knowledge": [
    "Use task envelopes for executor work."
  ],
  "open_work": [
    "HOWL-EXAMPLE"
  ],
  "decisions": [
    "ADR-0001"
  ],
  "risks": [
    "Verify changing provider capabilities before routing."
  ],
  "source_refs": [
    "ORG.md",
    "routing/capability-registry.yaml"
  ],
  "handoff_to": null,
  "contains_raw_chain_of_thought": false
}
